{
  "schema_version": 1,
  "cycle_id": "42",
  "config_revision": 1,
  "key": {
    "host_id": "demo-host",
    "boot_id": "demo-boot",
    "entity_id": "cpu.package.0",
    "metric_id": "cpu.temperature.package",
    "scope": "package:0"
  },
  "provenance": {
    "adapter_id": "hwmon",
    "source_id": "hwmon:package0:temp1",
    "origin_id": "sensor:package0",
    "origin_relation": "confirmed",
    "driver": "fixture-coretemp",
    "device_path": "fixture:///sys/devices/platform/coretemp.0/hwmon",
    "channel": "temp1_input",
    "generation": 1,
    "profile_id": "synthetic-cpu-package",
    "profile_revision": 1
  },
  "sample_kind": "simulated",
  "read_status": "ok",
  "quality": "verified",
  "native_unit": "mdegC",
  "value": {
    "type": "f64",
    "value": 68000.0
  },
  "read_started_boot_ns": "41950000000",
  "read_finished_boot_ns": "42000000000",
  "device_sample_boot_ns": "41990000000",
  "source_update_interval_ms": 1000,
  "reason_codes": [
    "SYNTHETIC_FIXTURE"
  ]
}
